course_number,title,term,credit_hours,instructor,description
EAS 544.001,Introductory Python for Geospatial Data Sciences I,Winter 2026,1.5,Shannon Brines,This 1.5 credit seminar course will serve as an introduction to Python for Geospatial Data Sciences and Natural Resources applications. Students will work through an online curriculum to learn Python and each week meet in seminar to discuss and explore together how Python can be used for environmental and natural resources applications.  Asstudents work through the concepts of Python they will create a final project program that integrates what they have learned for an application they devise.
EAS 546.001,Herb Flora & Ecosys,Fall 2025,4,Michael Kost,"This holistic field course will take students out into a variety of Michigan natural communities and highlight key native herbaceous plants in each unique environment. You will learn not only to identify important indicator species but also to practice a field-based ecological literacy and understanding of these plant communities. Herbaceous plant ID is an extremely useful skill, whether you’re interested in habitat restoration, landscape design, analyzing ecosystem health, or just simply getting to know your plant neighbors who also call this place home. As the semester progresses and winter approaches, lab sessions will shift indoors, and students will work with herbarium specimens to learn the intricate process of “keying out” plants based on biological features."
EAS 546.002,Herb Flora & Ecosys,Fall 2025,4,"Michael Kost Krick, Jason",
EAS 547.001,Wildlife and Society,Fall 2024,3,Neil Carter,"This course will largely utilize the social-ecological systems framework to understanding human-wildlife interactions and contemporary wildlife conservation issues from local to global scales. Topics include measuring and evaluating tradeoffs in ecosystem services and disservices of wildlife; balancing multiple expectations and priorities among diverse stakeholder groups; ethical implications of species management, rewilding and de-extinction; institutional fit and adaptive management. A main goal is to help students engage in creative problem solving in a way that crosscuts and transcends traditionally isolated disciplines. The course will train graduate students to take an interdisciplinary approach to analyze critically wildlife conservation issues occurring around the globe."
EAS 547.001,Wildlife and Society,Winter 2026,3,Neil Carter,"This course will largely utilize the social-ecological systems framework to understanding human-wildlife interactions and contemporary wildlife conservation issues from local to global scales. Topics include measuring and evaluating tradeoffs in ecosystem services and disservices of wildlife; balancing multiple expectations and priorities among diverse stakeholder groups; ethical implications of species management, rewilding and de-extinction; institutional fit and adaptive management. A main goal is to help students engage in creative problem solving in a way that crosscuts and transcends traditionally isolated disciplines. The course will train graduate students to take an interdisciplinary approach to analyze critically wildlife conservation issues occurring around the globe."
EAS 548.001,Intro Geovisualization,Fall 2025,1.5,Derek Van Berkel,"The significance of visuals in conveying and comprehending environmental and sustainability concerns is on a steadfast rise. Throughout this course, we will equip ourselves with the expertise to introduce interactivity and facilitate knowledge discovery, especially in the face of complex spatial challenges prevalent in our professional fields and research endeavors. You will acquire proficiency not only in fundamental cartographic and visual principles, but also in methods for collecting, scrutinizing, and presenting geospatial data sourced from contemporary mobile technologies and diverse repositories, both public and private. Our labs will be conducted using open-source software like QGIS and R Studio, thereby infusing vitality into the visualization and analysis of geographic data. The labs and lectures will be built upon real-world case studies in the domains of environmental equity, conservation, global environmental change, and urban design. This approach renders the course of high interest to a broad spectrum of students."
EAS 548.002,Intro Geovisual,Fall 2025,1.5,"Derek Van Berkel Grace, David",
EAS 548.003,Intro Geovisual,Fall 2025,1.5,"Derek Van Berkel Grace, David",
EAS 549.001,Anal&Mod of Env Data,Fall 2025,3,Kai Zhu,"This course provides a comprehensive overview of standard and innovative methods in environmental data analysis and modeling, with an emphasis on frequentist and Bayesian statistical approaches. The curriculum is designed to equip students with practical skills using open-source programs in R. Key topics include: probability theory, Bayes' theorem, common statistical distributions, stochastic simulation, likelihood-based parameter estimation, model comparison, and model diagnostics. We will also introduce linear models, generalized linear models, and mixed-effects models, exploring both frequentist and Bayesian inference for these complex structures. The course emphasizes active learning through frequent hands-on exercises, which give students the opportunity to practice new analytical and modeling techniques using real or simulated datasets. Another important component of this course is the individual project, where students will apply learned methods to their own data or simulated data relevant to their scientific interests. This project culminates in the writing of a complete report. The analytical process will cover initial exploratory data analysis, selection and implementation of statistical and modeling approaches, and effective presentation and discussion of results."
EAS 549.001,Analysis and Modeling of Environmental Data,Winter 2025,3,Inés Ibáñez,"The course will meet the Analytic or Stats requirement for the SEAS MS degree, but not both. This course will consist of an overview of standard and innovative techniques in ecological data analysis and modeling. Topics will include: linear regression, mixed effects models (fixed and random effects), maximum likelihood, general linear models and general additive models, survival analysis, time series, spatial analysis and Bayesian and hierarchical Bayesian approaches. This course is designed for students to work on their own data, or simulated data, related to their research projects or scientific interests. While reviewing the major statistical methods used in ecology, students will work on their projects and will be presenting their work to the class along the semester, these presentations will consist on: initial exploratory data analysis, selection of statistical analysis or modeling approach, implementation, and results."
EAS 551.001,Clim Chng Sci&Sol,Fall 2025,3,"Parth Vaishnav Chen, Jiahui","This course consists of four parts. The first part will provide a primer for those who are curious about the physical mechanisms by which climate is determined, and by which, climate change occurs. The treatment of these mechanisms will not be overly quantitative, and no prior knowledge of meteorology or atmospheric science is assumed. The second part will describe the projected consequences of climate change; and those that are already occurring. This part will also familiarize students with how societies might adapt to these changes. The third part will explore (and critique) some of the tools that decisionmakers use to quantify and compare the damages caused by these consequences. The final part of the course will discuss some of the technologies that could be deployed to stave off dangerous climate change."
EAS 551.001,Clim Chng Sci&Sol,Winter 2024,3,"Parth Vaishnav Bin Haji Nawawi, Shuhaib",
EAS 552.001,Methods and Approaches to Sustainability and Development Problems,Fall 2025,3,Rajiv Ghimire,"This course provides a practical introduction to the key methods and approaches for analyzing sustainability and development challenges. First, students will learn the basics of quantitative and qualitative approaches including introductory data analysis and visualization. Following that, using hands-on exercises, students will learn the five most common methods useful in the field of sustainability and development: 1) impact evaluation, 2) cost-benefit analysis, 3) social/environmental life cycle analysis, 4) institutional analysis, and 5) remote sensing and Geographical Information System (GIS). This class will enable students to measure the impact of policies and programs, assess the life cycle impacts of given products, and understand how institutions can influence sustainability and development. Students will learn about real-world practices as well as the application of research to policy development and the evaluation of progress in sustainability and development indicators. Further, this course will expose students to research ethics and enhance their skills to analyze the strengths and limitations of different methods. Learning Goals and Objectives 1. Understand quantitative and qualitative approaches and the nature of data and analysis. 2. Learn and use research methods suitable for analyzing sustainability and development problems including impact analysis, cost-benefit analysis, social/environmental life cycle analysis, institutional analysis, and Geographical Information System. 3. Learn techniques of data analysis, visualization, and interpretation of results. 4. Understand how research in sustainability and development can contribute to policy and program development and evaluation. 5. Select an appropriate approach relevant to the individual interest and use the learning to analyze a new and relevant sustainability case."
EAS 553.001,Diverse Farming Sys,Fall 2025,3,Ivette Perfecto,"In this interdisciplinary course, we will critically explore intersecting literature on agroecology, biodiversity, ecosystem services, diversified farming systems, agroforestry, and farmer's livelihoods. The first part of the course will focus on the application of ecological theory to the study of diverse farming systems including intercropping and agroforestry. The second part will emphasize biodiversity both in terms of how agricultural landscapes affect biodiversity and how biodiversity contributes to the sustainability, productivity and resilience of agroecosystems and farming communities. The last part of the course will cover some of the most salient social issues in diverse farming systems, such as tree and land tenure and gender issues as well as the social rural movements that promote diverse farming systems and agroecology. Watch Faculty Introduction"
EAS 554.001,Sci&Mgmt of G Lakes,Fall 2024,3,Karen Alofs,"This course reviews the broad sciences required for appreciation and understanding of the Great Lakes Ecosystem, and simultaneously explores the challenges inherent in sustainable management of both the Lakes themselves and the societal benefits they support. A rich collection of online lectures by regional experts will provide background scientific understanding of the Great Lakes as a vast, complex and invaluable ecosystem. Class activities will include case studies that illustrate the complexities of current management and policy initiatives aimed at sustaining ecosystem health and services; case study exercises will be resourced by an experienced guest practitioner from the Great Lakes community. Students will also work collaboratively to build case studies on current Great Lakes issues."
EAS 554.002,Sci&Mgmt of G Lakes,Fall 2024,3,Karen Alofs,
EAS 555.001,Climate & Development,Winter 2026,3,Rajiv Ghimire,"Broadly understood, scholarship on climate change and development remains in its infancy.  Whereas there has been an extensive attention paid to both issues through the years, only recently they have come together both as a field of inquiry and practice.  Historically development policies emphasized centrally sponsored programs of change and large-scale projects to foment economic growth.  Scholarship in the human dimensions of climate change have mostly focused on anthropogenic drives and mitigation and only more recently has started to explore impacts and adaptation more seriously.  This class seeks to bring these two themes together by focusing on how development and climate change intersect both in policy design and implementation as well as a new focus of research and production of knowledge. The course is organized around themes interspersing climate change and development.  Part 1 is a historical look on development theory and practice and the emergence of climate change as a critical stressor to be taken into account for future policy making. Part 2 focuses on potential impacts of climate change in less developed countries.  Part 3 explores response options with an emphasis on adaptation, resource management, to the emergence of global institutions for environmental governance."
EAS 556.001,Transform Food Systm,Fall 2023,1.5,"Ivette Perfecto Hoey, Lesli","This course aims to build students' ""equity competency"" - the knowledge, skills and values needed to recognize and address historical and persistent structural inequities that pervade today's food systems. Drawing on multiple knowledges; experiential, systems-based and peer learning; field trips; speakers; critical reflection and discussion; and project-based learning, students will: a) learn key definitions associated with structural racism and strategies for addressing equity in the food system, b) reflect on their identities, values, implicit biases, and leadership styles, c) study inequities across various food systems dimensions, scales, and geographies, d) explore diverse career pathways for catalyzing food systems change, and e) practice interpersonal, communication and organizational leadership skills needed for collective action and policy advocacy. The goal is to prepare reflective, visionary and strategic food systems scientists and leaders who use systems thinking, collaboration, and an ethics of justice."
EAS 557.001,Indus Ecol,Winter 2026,3,"Benjamin Goldstein Baldwin, Owen, Kothari, Mallika","Industrial ecology is the systematic analysis of global, regional and local material and energy flows and uses that are associated with products, processes, industrial sectors, and economies. Energy consumption, non-renewable and renewable materials consumption, air pollutant emissions, waterborne pollutant effluents and solid waste generation associated with human activities are tracked. These analyses are the core tools of industrial ecology, which seeks to design and manage products and services that meet human needs in a sustainable manner. Industrial Ecology provides a scientific foundation for advancing the “Circular Economy,” which is a framework gaining the attention of business and industry. The course will provide you with analytical tools and methods for implementing principles of industrial ecology and the circular economy. The practical applications covered in the course will be based largely on current research in the area of life cycle assessment (LCA) and life cycle design. Life cycle assessment is a comprehensive tool for identifying and evaluating the full environmental burdens associated with a product system from production through retirement. This methodology is used for comparative analyses of alternatives including materials (e.g., biobased vs petroleum based), energy systems (renewable and fossil fuels), consumer products and packaging, automotive component designs, and residential construction methods. Other analytical tools covered include ecological footprint analysis, carbon footprint analysis (life cycle assessment of greenhouse gases), and life cycle cost analysis. Life cycle design focuses on integrating environmental considerations into product design. The challenge is to align and meet performance, cost, legal, and cultural requirements while achieving environmental improvements."
EAS 558.001,Water Pol & Polit,Winter 2024,3,,"This course provides a foundation in the legal and institutional dimensions of U.S. water policy, and an in-depth examination of the political challenges of water sustainability and equity. Course topics include perspectives from local, state, national, international contexts. Students will gain substantive expertise in the landscape and key levers of U.S. water policy and politics, strengthen their policy analysis skills, and work toward solutions to complex socio-environmental problems.   The course will strengthen EPP course offerings by building both understanding of public policy and political systems and the fundamentals of water law and policy specifically. The framework developed in the course for analyzing policy and politics will build on and largely mirror that in EAS 562, providing EPP students the opportunity to further develop those skills.  This course will provide a distinct policy and politics-focused approach to understanding water."
EAS 558.001,Water Policy & Politics,Fall 2025,3,Marc Smith,"Water is the basis for life. Water connects people, land, infrastructure, ecosystems, and the climate. The choices we make about how and where to use, transport, treat, or leave water resources have social, environmental, and economic consequences. These consequences are becoming more important over time. Water policy reveals the important effects of power in our political processes and decision making. This course provides an intensive graduate-level introduction to the legal and institutional dimensions of U.S. water policy and an in-depth examination of the political challenges of water sustainability and equity. Students will gain substantive expertise in the landscape and key levers of U.S. water policy and politics, strengthen their policy analysis skills, be exposed to leaders in the field, and work toward designing solutions to complex socio-environmental problems. The focus is on decision making processes, power structures, conflicts, and rules. The course focuses on U.S. freshwater policy and politics (although with some international examples) with a particular emphasis on the Great Lakes region."
EAS 559.001,Interview Methods & Qualitative Data Analysis,Winter 2026,3,"Alexandra Paige Fischer Zhang, Jenny","Individual and focus group interviews are critical methods for research and practice in environmental and sustainability fields. Interviews reveal detailed information about how and why people think and behave in the ways that they do, and the broader context in which people make decisions. This information can help decision-makers develop policies and programs to harness people's motivations to engage in environmentally sustainable behavior, and help them overcome constraints. This course will train students in individual and focus group interviewing as research strategies and practical tools for gathering information. It will also introduce students to methods for analyzing qualitative data to ensure rigor, usefulness, and communicability of results. The course will consist of lectures, role-plays, and peer feedback on interview project components, including research designs, interview guides, codebooks, analytical memos, and network and matrix displays of key findings."
EAS 560.001,Behavior&Environmt,Fall 2024,3,Raymond De Young,"People must become familiar with the behavioral consequences of energy descent and global heating, but they must not dwell on those issues. Instead, the focus must be on making a transition to a low-material-throughput pattern of living at individual, collective, and institutional levels (Mazur 2024). However, intentionally, and against the dominant social norm, this course frames this new reality as an opportunity to emphasize behaviors that increase well-being (De Young 2019). It foresees a shift toward tangible, small-scale initiatives aimed at building neighborhood resilience, with communities following Brooks’ (2019) advice to emphasize “…individualism less and relationalism more,” resulting in an unexpected increase in well-being."
EAS 560.002,Behavior&Environmt,Fall 2024,3,"Raymond De Young Woodward, Tara-Sky",
EAS 560.003,Behavior&Environmt,Fall 2024,3,"Raymond De Young Woodward, Tara-Sky",
EAS 561.001,Psy Env Stewardship,Winter 2025,3,Raymond De Young,"An enduring challenge of crafting a truly sustainable society is to create one in which people will want to live. Although it is an ecological necessity to live an austere existence, people will not eagerly pursue such a life if it is only presented as a necessity of survival. The issue here is psychological. How do we reframe and promote a sustainable existence so that people not only accept it, but actually seek it out? How do we support people so they begin building this society as soon as possible? These questions are explored through the framework of their being a behavioral challenge, not a political or technological issue. To meet this challenge, behavior change strategies are reviewed, some in early stages of development. Emphasis is on changing behavior in ways that it remains changed (durable) long after the intervention program ends, and expands to include new behaviors. Examples of such durable and growing behavior change are provided at the individual, neighborhood, and community level. Behavior change is further studied through the local, recently developed A2Zero carbon neutrality initiative."
EAS 561.002,Psy Env Stewardship,Winter 2025,3,"Raymond De Young Woodward, Tara-Sky",
EAS 562.001,Env Policy&Politics,Fall 2025,3,"Steven L. Yaffee Ho, Kenneth Law, Sinclair, Elisabeth","This course is designed to provide an intensive graduate-level introduction to the structure and dynamics of the U.S. environmental policy process. It is concerned both with policy formation – how proposals for action win sufficient support to be approved – and policy implementation – how policies and programs are actually put into effect. The course is intended primarily for students entering graduate or professional study in environmental policy, planning, and management or related fields. The course will meet for two 1-1/2 hour sessions per week. The format will be a mix of lecture and discussion. On days when case discussions are the primary focus, we will use our joint understanding of a policy issue and the policy process to examine what happened and why, and discuss what actors should do in a particular situation. The case discussions provide real settings to apply ideas about the policy process, probe historical behavior, and test strategy."
EAS 565.001,Princ of Transition,Fall 2023,2,Thomas Princen,"This is a 2-hour, 2-credit reading seminar in which students and instructor read four environmental books for in-depth, contextualized understanding of environmental trends and human ecological relations. Two books are read in common, most likely Cronon’s Nature's Metropolis: Chicago and the Great West and Kimmerer’s Braiding Sweetgrass: Indigenous Wisdom, Scientific Knowledge, and the Teachings of Plants. Two additional books, one a history, one fictional (or collection of stories) are chosen from a list. Prior to each class session students write and submit a “principle of transition” derived from the week’s assigned readings. It can take the form of a general causal pattern or a “do something,” that is, a practical implication of the readings. The principle should orient to 21st century transformation with rigorous sustainability as the goal. One of the two chosen books is presented in class, one is presented one-on-one to the instructor. A 3-page write-up of each book is submitted at the end of the semester (guidelines provided)."
EAS 567.001,Soc Vulnrblt&Adapt,Fall 2025,3,Alexandra Paige Fischer,"Increasingly frequent and severe wildfires, floods, and storm events raise concerns about how society can adapt to environmental change. The concept of social vulnerability is critical to identifying opportunities for adaptation. Social vulnerability refers to the geographic and socio-economic influences on the chance of harm to humans and the capacity of people to prepare and respond. Adaptations are strategies individuals, societies, or governments undertake in response to or anticipate environmental changes and climate threats. This three-credit course will introduce students to the concepts of social vulnerability and adaptation as well as frameworks for assessing vulnerability and planning adaptation in human communities. The course will explore theories and methods for investigating social vulnerability and adaptation from a behavioral perspective. We will not address these concepts from an environmental policy or politics perspective. Students will learn about methods for evaluating exposure, sensitivity, and adaptive capacity at different levels of social organization (individuals, communities, institutions), as well as approaches to designing vulnerability assessments and adaptation plans. The focus will be on climate change and related natural hazards relevant to coastal and inland areas, including wildfire, drought, flooding, sea level rise, and storm events. Small group discussions, projects, and conversations with practitioners will engage students in co-learning. By bringing different analytical perspectives and real-world case studies on vulnerability and adaptation, this class will help students understand, access, and promote sustainable and positive change in the face of accelerating global environmental changes."
