course_number,title,term,credit_hours,instructor,description
EAS 597.001,Environ Sys Analysis,Fall 2025,3,"Shelie Miller DeVries, Ben","This is a quantitative decision-making course.  At its core, the course employs a systematic framework to approach decisions, particularly those that have conflicting objectives such as economic and environmental concerns.  Optimal solutions for a variety of different systems will be obtained mathematically using a variety of linear and non-linear techniques. The purpose of this course is to train students on concrete and rigorous problem-solving tools that provide a mathematical basis for decision-making.  By the end of the course, students will be able to define systems and their boundaries, optimize systems for a set of constraints and objectives, recognize how different modeling choices of the same system can lead to different results, determine the sensitivity of decisions and optimal solutions based on changes in constraints, translate complex problems into mathematical frameworks, and define appropriate sets of solutions when there are multiple, competing objectives. Example problems span natural resource management, traditional environmental engineering processes, ESG principles, and issues in green design and environmental policy."
EAS 603.001,Thesis Development,Winter 2025,2,Brian Weeks,
EAS 607.001,Justice Agendas for Environmental Crises,Fall 2025,1.5,M'Lis Bartlett,"The guiding premise of this EJ course has long been co-creation and public deliverables in the form of recorded lectures and panel discussions. This iteration delves deeper into our respective motivations and experiences for work in environmental justice and sustainability. Together, we will practice communicating complex stories that matter by engaging our respective histories with environmental and social justice, and articulating personal curiosity as an anchoring guide. We will engage with experts in justice work and tools to critically understand personal learning, underrepresented perspectives, and the ethics of knowledge and data in justice work."
EAS 608.001,Entrepreneurship and Innovation for Sustainability,Fall 2025,3,Charlene Zietsma,"Massive societal changes are required to meet decarbonization, biodiversity, social justice and human thriving targets. Entrepreneurship and innovation by business, governments, civil society organizations and others are needed. In this course, teams will select problems they care about and use entrepreneurial/innovation processes to address them. We'll map system states and trends, identify pain points, and use future visioning, ideation and design thinking to identify improvements. We'll assess the business, social and ecological cases of potential innovations, iterating through stakeholder discovery processes, and culminating in pitches to experts. Along the way, we'll examine others' efforts to launch entrepreneurial ventures and innovations and discuss the factors that influence success and failure."
EAS 610.001,Adv LCA Methods&Tool,Winter 2026,1.5,"Parth Vaishnav Kothari, Mallika",This course is intended for students who have taken (or are currently enrolled in) Industrial Ecology and wish to expand their life cycle assessment (LCA) skills. The course covers advanced LCA methods and key software tools used to conduct LCA studies (including SimaPro).
EAS 615.001,Renew Elec&the Grid,Winter 2026,3,,
EAS 615.301,Renew Elec&the Grid,Winter 2025,3,"Michael Craig Uppal, Jaya",
EAS 620.001,AR/VR for Sustainab,Winter 2024,2,Mark Lindquist,
EAS 625.001,Deep Decarbonization,Winter 2025,2,Michael Craig,"This discussion-based seminar will explore technologies and policies for deep decarbonization of the economy consistent with aggressive climate change mitigation targets. The goal of the course is to familiarize students with the challenges of and solutions to deep decarbonization. Readings will include parts of the Intergovernmental Panel on Climate Change Fifth Assessment Report, reports from governments and non-governmental organizations, peer-reviewed journal articles, and policies from around the world. The course will start with a discussion of climate change impacts and required greenhouse gas emission reduction trajectories, then delve into sectoral decarbonization needs and strategies, concluding with a review of current efforts and their potential contribution to mitigation. This course is designed for graduate students, with preference given to SEAS graduate students, but junior and senior undergraduates and graduate students from all other schools are welcome to apply."
EAS 630.001,Prep for International Fieldwork,Winter 2026,1.5,Bilal Butt,"This new seminar class is intended for students with limited fieldwork experiences, and who will likely be working on an international field project (MS project, thesis, dissertation, etc) over the summer. The course is designed as a weekend workshop and has three main elements, with the following topic areas. Part I : Conceptualizing International Fieldwork. Intro to the class, recognizing positionality and privilege in fieldwork, ethics in international fieldwork and research, safety in international fieldwork. Part II: Operationalizing Fieldwork Under the ""Rough and Tumble"" of Everyday Life. Survey instruments, recruiting research assistants and translators, arrival, field notes, and departures, participatory methods in mapping, citizen science and other techniques, navigating bureaucracies and dealing with crisis. Part III: Reflections on Fieldwork: Key Lessons and Advice for Students. Roundtable panel discussion with faculty, MS Thesis, Project, and PhD students."
EAS 635.001,Multivariate Stats,Fall 2024,3,"Drew Gronewold Li, Kunxi","Multivariate analysis provides the foundational tools for understanding and analyzing data sets that require simultaneous examination of multiple variables. This course aims to enable students with the ability to describe, explore, and find order in data, and to extract underlying structure and patterns. While the course is intended to provide students with a background suitable for a variety of applications, the emphasis will be on the environmental sciences. Further emphasis will be placed on a working knowledge of conventional statistical methods, use of software packages (primarily R), and problem solving. Students will be expected to have a reasonable level of competence in statistics (i.e. will have taken a basic statistics course such as EAS 538). Basic knowledge of R or similar software is helpful, but not required. The course will culminate with submittal of an individual semester-long project designed to apply fundamentals from the course to a data set selected by the student."
EAS 635.001,Multivariate Stats,Winter 2026,3,"Drew Gronewold Wang, Hanyang","Multivariate analysis provides the foundational tools for understanding and analyzing data sets that require simultaneous examination of multiple variables. This course aims to enable students with the ability to describe, explore, and find order in data, and to extract underlying structure and patterns. While the course is intended to provide students with a background suitable for a variety of applications, the emphasis will be on the environmental sciences. Further emphasis will be placed on a working knowledge of conventional statistical methods, use of software packages (primarily R), and problem solving. Students will be expected to have a reasonable level of competence in statistics (i.e. will have taken a basic statistics course such as EAS 538). Basic knowledge of R or similar software is helpful, but not required. The course will culminate with submittal of an individual semester-long project designed to apply fundamentals from the course to a data set selected by the student."
EAS 639.001,Fisheries Management,Winter 2025,2,,"In our oceans, lakes, and rivers, fish populations are increasingly stressed due to anthropogenic factors such as loss of habitat, invasive species, overfishing, and climate change.  In this course, students will learn the fundamental tools used by fisheries scientists to understand and manage fish populations in an ecosystem context.  We will also discuss the policy implications relevant to fisheries management.  Although fisheries are the focus, previous students that don’t envision a specific fisheries career have enjoyed the class as it has broadened their perspective on natural resource science and management.  Motivated undergraduates are also welcome to sign up for this graduate-level seminar."
EAS 639.024,Global Env Change & Food Sys,Winter 2025,1.5,Meha Jain,
EAS 639.039,Adv Sem in Res Ecol,Winter 2024,1,,
EAS 639.108,Con Bio & Ecosystem Health,Winter 2026,1,Johannes Foufopoulos,"The seminar will cover a range of topics that deal with principles and management of biodiversity in general, and the role of pathogens in these processes more specifically. Course participants will explore the diverse links between environmental health and human well-being. Recent advances in this area demonstrate that parasites and pathogens, aside from being an important component of biological diversity, can shape the function of whole ecosystems. Human activities alter pathogen distributions in multiple ways, which not only affect ecosystem health, but have also important ramifications for conservation management."
EAS 641.001,Soc Res Mthd Env&Sus,Winter 2026,3,Avik Basu,"Social Research Methods in Environment and Sustainability is oriented to students who are likely to engage in research of any kind, formal or informal, that is concerned with people and the environment. The course has been useful for those with minimal research experience as well as students who have carried out research in the past. The course is equally applicable whether you anticipate doing a thesis or dissertation, are in the throes of carrying out a study, and/or hope to gain perspective on past efforts with the research process. Neither statistics nor current involvement in research is prerequisite to the course. In the latter portion of the semester, working in teams, a small study is carried out that provides the opportunity to put many of the course’s themes to use."
EAS 644.001,Intermediate Python for Geospatial Data Sciences II,Winter 2026,1.5,Shannon Brines,"This course is intended to simply be an opportunity to gain some experience with a real-world skill/technology that is in high demand: that is knowledge and understanding of how one might integrate the Python language into work that you do. You might think of this course as a support group for people who wish to continue to improve their abilities, with python. Specifically, during this half-semester we will work on writing/designing python scripts and workflows in general; writing/designing python scripts and workflows that undertake real-world geospatial tasks; and developing strategies for you to continue learning Python after this half-semester concludes. This course is intended for students with prior experience in programming, including some exposure to the python language."
EAS 648.001,Advanced Geovisualization,Fall 2025,1.5,Derek Van Berkel,"Visuals are becoming increasingly important for communicating and understanding environmental and sustainability issues.  In this course, we will employ an open data science approach to geovisualizations, bringing greater interactivity and knowledge discovery to the highly spatial challenges that we encounter in our professional and research domains. We will learn techniques for extracting insights from spatial data for better communication of our results. The course will cover terrain modelling, semantic analysis, statistical and machine learning techniques, web mapping, and animation using R Studio. Labs and lectures are based on case studies in environmental equity, conservation, global environmental change and urban design, making this course of interest to students broadly."
EAS 648.002,Adv Geovisual,Fall 2025,1.5,"Derek Van Berkel Grace, David",
EAS 648.003,Adv Geovisual,Fall 2025,1.5,"Derek Van Berkel Grace, David",
EAS 652.001,GPS and Geospatial Field Technologies,Winter 2026,2,Shannon Brines,"This semester long course focuses on two core geospatial field methods and technologies: GPS (global positioning systems) and field data collection tools using integrated GIS and GPS (e.g. Survey123, ArcGIS Field Maps, and others). At times we will compare some of these tools and methods to more ""old school"" field methods. Main topics in GPS discussed are: use of different levels/grades of GPS instruments and peripherals; best practice data collection for point, line and polygon surveys; different methods of both real-time and post-collection differential correction; and assessment and improvement of accuracy/precision. Main topics in field data collection tools are: use of Field Maps / Survey123 to acquire point, line and polygon features; development of and use of forms in Field Maps and Survey123 for field data collection and planning; and overall spatial data collection project design."
EAS 661.001,Conservatn Beh Sem,Fall 2023,2,Raymond De Young,
EAS 668.001,Advanced Natural Resource Economics,Fall 2025,3,,"This course reviews the literature on the pricing of natural resources (agricultural goods, renewable and nonrenewable resources and durables) over time. The first half of the course considers resources which are privately owned; the second half considers resources that are common property. To provide a point of reference, the behavior of resource markets in the absence of government intervention is studied first. There is then an extensive treatment of the dynamic effects on market equilibria of widespread government policies (unanticipated, partially anticipated or fully anticipated). Policies analyzed include: bufferstocks used to affect prices (ceilings, floors, bands, and pegs); bans, embargoes, price controls and whatever else is timely or of interest to participants. To simplify the mathematics, discrete-time methods are used predominately. The Kuhn-Tucker theorem is utilized when studying competitive equilibrium under certainty. Dynamic-programming is used to study single-agent (planning or monopoly) problems under uncertainty (with or without learning). Multi-stage game theory is used to investigate dynamic common-property problems. A working understanding of these methods is developed during the course."
EAS 669.001,Environmental Econ,Winter 2026,3,,
EAS 677.001,Education for Environmental Justice and Action,Winter 2025,2,"Michaela Theresia Zint Gallay, Erin Elizabeth","This course is grounded in the belief that socio-environmental issues, including wicked challenges like climate change, must be addressed as social justice concerns. Transformative education, broadly defined, is critical for cultivating the skills, values, and sense of agency necessary to take collective action on political, structural, and societal policies and practices, ensuring that equity and sustainability are intertwined in society's plans for the future. Open to undergraduate, graduate, and doctoral students from all U-M schools and colleges, this seminar will explore how to approach environmental education, communication, and social change from a justice-oriented perspective. The central focuses will be on theory and practice that further environmental justice and action, the design of learning environments that empower and foster social change, and building capacity in ourselves and others to become agents of change for democratic, socially just, and sustainable communities. As colleagues in this course, we will engage in interdisciplinary and inter-organizational dialogue and inquiry through experiential pedagogy. We will explore educational resources and frameworks designed to broaden who is represented in environmental decision-making and unveil who is left out. Through readings and guest speakers, we will develop our own visions of best practices, building on theories and foundational pedagogy in critical education, social movement learning, community-based participatory learning, place-based/land-based education, environmental justice organizing, and justice-oriented science education. We will draw upon these frameworks and traditions to understand and practice strategies and skills used to advance social change and public engagement in community decision-making. Special attention will be paid the role of building community in developing, exploring and sustaining an activist role in communities as we deepen our understanding of power, positionality, identity, and community/civic engagement. Through preparation and practice in class, we will focus on effective practices of organizing, gaining skills to engage in social action ourselves. We will practice organizing skills such as storytelling, power and asset analysis, and communication. We will apply the knowledge and skills we develop to create and implement a plan of action for a desired changes in the community."
EAS 677.001,RPB Research Sem,Fall 2024,1,,
EAS 677.002,Make it in the Media - Strategic Communications & Design for Impact,Fall 2023,1.5,"Dave Brenner Love, Carole","Employers in the sustainability field are increasingly seeking individuals who not only understand the science and solutions needed to solve the world’s most pressing environmental challenges but also who have the communications and storytelling skills to make science and sustainability more accessible to the public. To address this critical and growing need, we’ve designed a skills-based course to help students develop the expertise needed to communicate science effectively in real-world scenarios across a number of channels. Through this course, students will learn: media pitching and live interviewing skills; how to leverage social media channels; graphic design; web; and photography/videography skills to present information in a visually compelling way. We will also discuss how to establish a personal brand and how to position yourself as a thought leader in your field. Students will learn how to craft compelling and informative stories, infographics, community outreach materials, op-eds, and press releases to bridge the gap between science, sustainability, and the general public. Whether you want to be in academia, business, nonprofit work, or community engagement, strong communications skills are critical to making a lasting impact. There are no prerequisites for this course, and it is open to graduate students in all SEAS specializations."
EAS 677.002,Strategic Comm & Design for Impact,Winter 2026,2,"Dave Brenner Love, Carole","Employers in the sustainability field are increasingly seeking individuals who not only understand the science and solutions needed to solve the world’s most pressing environmental challenges but also who have the communications and storytelling skills to make science and sustainability more accessible to the public. To address this critical and growing need, we’ve designed a skills-based course to help students develop the expertise needed to communicate science effectively in real-world scenarios across a number of channels. Through this course, students will learn: media pitching and live interviewing skills; how to leverage social media channels; graphic design; web; and photography/videography skills to present information in a visually compelling way. We will also discuss how to establish a personal brand and how to position yourself as a thought leader in your field. Students will learn how to craft compelling and informative stories, infographics, community outreach materials, op-eds, and press releases to bridge the gap between science, sustainability, and the general public. Whether you want to be in academia, business, nonprofit work, or community engagement, strong communications skills are critical to making a lasting impact. There are no prerequisites for this course, and it is open to graduate students in all SEAS specializations."
EAS 677.015,Social Media for Sustainability,Winter 2025,1.5,Derek Van Berkel,"In the digital age, social media has emerged as a potent force for driving sustainability initiatives, and heightening environmental awareness, and now stands as an innovative data source for addressing sustainability-related inquiries. This seminar will provide an in-depth, critical, exploration of the strategic use of social media platforms as a catalyst for promoting sustainability research, ecological conservation, and climate action. The seminar will employ an interactive format with group and student-led discussions, live experiments, and critical analysis of case studies. Students will be encouraged to explore, debate, and critique how social media addresses real-world sustainability challenges. Moreover, we will compile best practices for utilizing social media in sustainability initiatives. You will 1) reflect on sustainability literature using social media, and evaluate sustainability messages and its influence;  2) become familiar with biases introduced by various platforms; and 3) gaining insights into the ethical and legal dimensions of sustainability communication through social media. Join us in this engaging and thought-provoking seminar to unravel the potential of social media as a force for sustainability, where your insights and ideas can be catalysts for positive change. This seminar is tailored for graduate students, and anyone (including upper-level undergraduate students) seeking to deepen their understanding of the vital role social media plays in advancing sustainability."
EAS 677.022,Econ and Environmental Justice,Fall 2024,1,Samuel Stolper,"This half-semester seminar is a group exploration of the relationship between economics and justice in the context of environment, energy, and climate. We will inspect positive and normative elements of economic analysis as it is practiced; we will investigate the causes of and potential solutions to disproportionate pollution exposure among the poor and people of color; we will study the measurement of distributive justice; and we will discuss the market and its limits. Applications will include air quality, water affordability, and climate change mitigation, among others. Inclusive, open-minded discussion will be the top priority in-class meetings; lecture will be used to clarify economics concepts and inform our discussion. Assignments will feature writing and potentially some quantitative analysis."
EAS 677.041,Resilience Solutions: Climate Adaptation from Global to Local,Fall 2025,3,"Rosina Bierbaum Muhich, Tim","This seminar will delve into the specifics of climate change adaptation activities taking place internationally and domestically in different regions and across different sectors. Emphasis will be placed on understanding the different components of climate change adaptation and resilience, and how stakeholders at international, national, state, local, private sector, and nongovernmental levels are taking action to address existing and projected climate impacts with a focus on equitable outcomes."
EAS 677.042,Documenting Environmental Justice,Winter 2026,1.5,Paul Mohai,"The key objective of this class is to learn about the key leaders and influencers in the environmental justice field and movement and to capture their knowledge, insights, and wisdom for future generations via one-hour video recordings. These recordings are intended to create a video library collection on environmental justice that will be helpful to other classes in SEAS, the University of Michigan, and other institutions around the nation and the world. Last year we interviewed EJ pioneers Robert D. Bullard, Charles Lee, Beverly Wright, and Peggy Shepard. In Winter 2026 we will be starting at a much higher end of the learning curve, and I expect we will interview considerably more leaders. Students will help to research the leaders, craft questions for them, and participate in creating the recordings. For those taking this class, it will be helpful if you simultaneously enroll in EAS 501(042), Environmental Justice New Directions, but it is not mandatory."
EAS 677.055,Writing for Environmental Justice & Sustainability,Winter 2026,1.5,Heidi Hausermann,"As graduate students and scholars, we are required to write a great deal. Yet, there is a lack of graduate coursework dedicated to how we write. This course addresses this gap, with a focus on writing for environmental science and change, sustainability, and/or environmental justice. The course is designed to help students move forward with a piece of writing, whether a manuscript, conference paper, proposal, client report, etc. In addition to activities geared toward improving written pieces, we will also work on editing and the peer-feedback process. This is a weekend-long course held in February 2026."
EAS 677.056,Risk and Adaptive Behavior,Winter 2026,1.5,Alexandra Paige Fischer,"At the heart of this graduate-level seminar is a question: why, despite objective evidence of risks to health, livelihoods, and property from natural hazards and climate change, do individuals often not change their behavior ? People’s decisions to protect themselves from risks, hazards, and climate change are complex and multifaceted, influenced by awareness, perception, access to resources, and social norms, among other factors. We will delve into theories and examples to understand individual human behavior regarding risks, hazards, and climate change. The course will help prepare students for applied research and professional positions designing, implementing, and evaluating programs and policies to enable, encourage, and incentivize behavior change to protect the well-being of individuals and households."
