course_number,title,term,credit_hours,instructor,description
EAS 409.001,Ecol of Fishes,Fall 2025,4,,"Covers physiological, behavioral, and numerical responses of fishes to biotic and abiotic factors; the relationship between fish and the physical, chemical, and biological parameters of major habitat types; adaptations of fish for survival under different constraints."
EAS 409.002,Ecol of Fishes,Fall 2025,4,,
EAS 409.003,Ecol of Fishes,Fall 2025,3,,
EAS 422.001,Biol of Fishes,Fall 2024,3,,"Lectures cover many aspects of the biology of lower vertebrates known as fishes, including evolution, physiology, functional morphology, phylogeny, biogeography, ecology, and reproduction. The systematic position of fish among vertebrates is discussed and exemplary assemblages exam."
EAS 423.001,Bio Fish Lab,Fall 2024,1,,"The Biology of Fishes lab complements the Lecture section of Biology of Fishes, but can be taken as an independent course. The lab introduces fish biology emphasizing anatomy, functional ecology, evolutionary biology and the diversity of major groups of world and Michigan fishes in an explicit phylogenetic context. The lab links basic morphology to function and how it relates to fish ecology and evolution. It will also introduce basic methods in fish biology and illustrate some modern methods to discover and study fish diversity in ecology and evolution, and to monitor fisheries sustainability."
EAS 430.001,Soil Ecology,Fall 2025,3,Brendan O'Neill,"Soils as central components of terrestrial ecosystems. Major emphasis is placed on physical, chemical, and biological properties and their relationships to plant growth and ecosystem processes. Understanding is developed using a combination of lectures, field- and lab-based exercises, and individual research."
EAS 430.002,Soil Ecology,Fall 2025,3,"Brendan O'Neill Gunther, Ana",
EAS 430.003,Soil Ecology,Fall 2025,3,"Brendan O'Neill Gunther, Ana",
EAS 433.001,Ornithology,Fall 2023,4,,"During the lecture, students have the opportunity to learn about many unique features of birds.  In the mandatory lab, students have the opportunity to learn about birds by using museum specimens, and by observing birds on field trips."
EAS 433.002,Ornithology,Fall 2023,4,,
EAS 436.001,Woody Plants,Fall 2025,4,,"In this course, species identification is the starting point for understanding the biology of woody plant species and ecological communities. The identification portion is taught in the field and with specimens in the lab. We’ll visit beech-sugar maple forests, oak-hickory forests, river floodplain forests, a second-growth forest on an old lake plain, swamps and bogs, roadsides, and highly disturbed sites. You’ll become familiar with several forest types and natural communities in SE Michigan. The lectures start with the nuts and bolts of identification and transition to broader topics related to our species, including pollination and dispersal, community and ecosystem ecology, evolution, ethnobotany and climate change. We'll end the semester with student presentations."
EAS 436.002,Woody Plants,Fall 2025,4,,
EAS 436.003,Woody Plants,Fall 2025,4,,
EAS 436.004,Woody Plants,Fall 2025,4,,
EAS 436.005,Woody Plants,Fall 2024,4,,
EAS 444.001,FoodLiteracy for All,Winter 2026,2,,"The Food Literacy for All course offers a unique opportunity for students to gain an interdisciplinary overview of crises and opportunities in today’s food system through a weekly lecture series featuring high-profile speakers from diverse sectors: academia, grassroots movements, public health, farming, and more. Designed as an academic-community partnership, the course is co-led by a UM Program in the Environment faculty member, a Community Co-Instructor who is a local food systems leader, and the Food Literacy for All Coordinator, with support from a GSI, and a number of others. The course is unique in this model of instruction and is open to anyone in the community, near or far, due to its remote nature, allowing them to attend the weekly webinars for free."
EAS 447.001,Forest Ecology&Mgmt,Fall 2025,4,Stella Cousins,"In Forest Ecology and Management, students will apply biological and ecological concepts to forest ecosystems, focusing on how forests are affected by and provide for human landscapes. First, students will build an understanding of the elements within forests and the factors and processes influencing them. Then, students will use current ecological research and management examples to examine contemporary challenges to trees and forests that stem from global change (e.g. climate shifts, landscape fragmentation, pollution, introduced species) as well as forests’ resilience and potential for restorative processes. Field and computing labs will focus on assessing forest patterns, functions, key demographic features, biodiversity, and carbon storage dynamics. Measurements will be drawn first-hand from UM-SEAS’ Saginaw Forest, our primary study site throughout the term. Students will gain skills in direct vegetation measurement, sampling design, reading primary literature, and environmental data synthesis. Labs will additionally provide practice with tools for field data visualization and analysis in R. All students will complete an in-depth independent study using primary scientific literature. Graduate students will further apply their study and the concepts discussed toward the development of a research proposal or land management plan for an existing forest site of their choice."
EAS 447.002,Forest Ecology&Mgmt,Fall 2025,4,Stella Cousins,
EAS 447.003,Forest Ecology&Mgmt,Fall 2025,4,Stella Cousins,
EAS 451.001,Biol of Mammals,Winter 2026,4,,
EAS 451.002,Biol of Mammals,Winter 2026,4,,
EAS 451.003,Biol of Mammals,Winter 2026,4,,
EAS 457.001,AfriChina EnvironDev,Winter 2024,3,,When China Comes to Town: Environment and the Politics of Development in Africa - This course will address post-colonial African states as a historically unique social form that presents special challenges for the socioeconomic and political analysis of environment and development. The course will focus on the growing interest of emerging world economic powers such as China in Africa's natural resources.
EAS 475.001,Environ Law,Winter 2026,3,Kimberly Smith,"Environmental Law introduces you to the history and current structure of American environmental law. It addresses the constitutional foundations of environmental law, some major federal environmental regulatory statutes, and current debates over governmental management of the environment. Topics include: federal authority over public land and water, tribal authority over natural resources, how to ensure environmental justice, and whether and how federal or state government can address climate change. There will be no exams; grades will be based on written work and a group presentation."
EAS 475.002,Environ Law,Winter 2026,3,"Kimberly Smith Williams, Jessie",
EAS 475.003,Environ Law,Winter 2026,3,"Kimberly Smith Williams, Jessie",
EAS 475.004,Environ Law,Winter 2026,3,"Kimberly Smith Williams, Jessie",
EAS 476.001,Ecosystem Ecology,Winter 2026,3,,"Current theories about the control and function of ecosystems, the approaches and techniques being used to test these theories, and the application of theory to the management and restoration of ecosystems."
EAS 480.001,Climate Change,Winter 2026,3,,"All sectors of society are affected by climate change:  science, policy, business, economics, public health, energy, ecosystems, environmental engineering, journalism, religion, etc.  This course explores the intersections of these communities and exposes students the factual and contextual elements that will allow effective participation in the adaptation to climate change."
EAS 501.001,Professional Practice,Winter 2026,3,Paul Kissinger,"This course will offer students an opportunity to learn about how environmental design professionals such as landscape architects work and function in a variety of practice types, from private firms to multidisciplinary firms, governmental agencies, and non-profit NGOs. Topics will cover an array of issues, including office practice and structure, project management, contracts, project management, running effective meetings, licensure, and more. Numerous guest speakers will cover a variety of questions and discuss their own professional context. Students will refine their resumes, portfolio, and cover letter as an assignment in order to assist in the search for positions after graduation. Additional assignments will include research into firms, development of questions for class discussion, learning about typical office responsibilities, contracts, the design process in an office environment, construction administration, proposals, and readings. The overarching goal of the course is to prepare students for entry into an environmental design profession and to inform them of the many options available to them upon completion of their studies at the University of Michigan."
EAS 501.001,Proseminar: Interdisciplinary Approaches to African Studies,Fall 2024,3,,"This course provides an interdisciplinary overview of the history, societies, and political-economic development of sub-Saharan Africa.  The course largely draws on the research expertise of members of the AAS faculty and is aimed at broadening graduate student understanding of the continent, allowing a forum for the interchange of ideas among grad students in a diversity of disciplines."
EAS 501.002,Water Law,Winter 2025,3,,"Water is arguably the world's most precious resource, and learning water law is vital to understanding the present and future of water access. Generally, water law refers to the laws that govern ownership, access to, and management of water contained in rivers, lakes, and aquifers, as well as the land that immediately underlies those water resources. Specifically, this class will cover: the distinction in surface water interests between the riparian doctrine in the wetter eastern United States and the prior appropriation doctrine in the more arid western United States; groundwater interests in shared aquifers; the public trust doctrine; water inequality; dams and watercourse management; takings claims; federal water interests; interstate compacts; Supreme Court original jurisdiction over interstate water disputes; water rights in Indian country; transnational management of shared surface waters and aquifers; and the common enemy doctrine governing water redirection. In the examination of those topics, we will consider relationships of water law to issues of development and economic policy."
EAS 501.003,"Organizing: People, Power, and Change",Winter 2025,3,,"Do you want to learn how to make lasting changes on a larger scale than one person can normally achieve? Organizers do that by identifying, recruiting, and developing leadership; nurturing community around that leadership; and building power from the resources of that community. In this course, you learn how to do this kind of organizing in your workplace and your community. You will form leadership teams of 3 to 5 classmates based on common values, identify the constituency with which your team will work, develop a campaign strategy to make a change that constituents think is important, try to implement that strategy. Organizing is a craft: you learn by doing and you get better with practice. You will learn five core leadership practices: building public relationships, turning values into motivation through public narrative, turning resources into power by strategizing, turning intentions into effective action, and structuring organization to develop leadership, engage constituents, and achieve goals. You will also learn to coach others and to receive coaching in organizing practices."
EAS 501.004,Power Building and Community Organizing for Social Justice,Winter 2026,3,Michelle Martinez,"What is collective power? How do you build it? What is social justice? How do you achieve it? In this class students will ask the question of what it takes to build the kind of movements, and organizations, that seek to bend the arc towards justice through activism. The class will seek to understand the tactics and strategies that groups develop to build community power, how groups organize and escalate, to contend with global markets, political hierarchies, and economic and political power structures.  We will briefly look at the political framework of racial capitalism and the neoliberal project as the context through which power is wielded and against which campaigns are developed and waged. Participation is key, and students will practice “group work”, review and create a case study, and should seek to develop their own viewpoints on the phrase “theory of change”."
EAS 501.005,Advancing Climate Education,Winter 2026,2,,"This seminar is open to undergraduate, graduate, and doctoral students from all U-M schools and colleges, students who will work together to learn what actions and interventions can be taken to help mitigate climate anxiety and encourage action in both the students and their communities. Our goal is to provide SEAS, U-M and other institutions with specific recommendations for interventions to implement to ensure climate anxiety is turned into action."
EAS 501.006,International Agrifood Systems,Winter 2026,3,Allan Hruska,"This course uses a political economy lens to review and understand different agrifood systems worldwide, how they got to where they are, what drives them, and what's needed to improve their outcomes. We examine several critical agrifood systems and evaluate them using a set of sustainability metrics. We review recent research advances and discuss the transformation of the agrifood system."
EAS 501.008,Project Management,Winter 2026,3,Rajiv Ghimire,"The demand for research and practice at the intersection of project management and sustainability has grown rapidly in recent years. Projects are initiatives that are temporary, unique, and focused on achieving specific outcomes. Creating, implementing, and completing projects is crucial for meeting sustainability objectives. No wonder project management is one of the most sought-after skills in the job market. This class covers the fundamentals of project management, helping students develop project management and teamwork skills, focusing on applications in sustainability. Students will gain an understanding of the history of project management and the role of projects in addressing sustainability issues, and critically, how to lead as a project manager. This class will focus on the project life cycle, including initiation, planning, execution, problem solving, monitoring and evaluation, and closure. Course material includes inquiry and training in several knowledge areas related to project management, including scope, quality control, risk assessment, time management and scheduling, budgeting, communications, and leadership. We will also examine the ethics and critiques of project management, with application to sustainability, sustainable development, and interdisciplinary topics. By covering standards and certifications of project management in sustainability, this course will prepare students to take leadership as change agents."
EAS 501.009,Black Food Sovereignty,Winter 2026,3,shakara tyler,"This course will explore Black Agrarian Cooperatives and the connections to grassroots movements from historical and contemporary lenses. The goal of this course is to develop an analysis of food, farm, land, and environmental cooperatives as anti-capitalist strategies and practical implementations of justice. The course will examine historical and current case studies of Black cooperative philosophy and practice and how they operate in grassroots movement settings. Students will develop an understanding of the historical and contemporary factors that shape the emergence of Black agrarian cooperatives as acts of sociopolitical and socioeconomic resistance, community self-determination, and empowerment. Students will analyze grassroots case studies, policy landscapes, and community discourses connected to Black agrarian cooperative formations."
EAS 501.009,Sustainable International Development,Fall 2025,3,Allan Hruska,"This course offers an in-depth examination of sustainable international development , exploring key concepts, policies, and practices that shape the global development agenda. Students will critically analyze: Development theories Strategies employed by international organizations The impact of development interventions on various regions The course emphasizes understanding the roles of different stakeholders in addressing development challenges, including: Governments Non-governmental organizations (NGOs) International organizations The private sector"
EAS 501.010,Environmental Law and Policy,Fall 2025,4,,"This course provides an introduction to the laws and regulations we use to address environmental harms. It focuses on the major pollution control statutes, particularly the Clean Air Act, Clean Water Act, Resource Conservation and Recovery Act, Comprehensive Environmental Response, Compensation and Recovery Act, and Toxic Substances Control Act. We will also examine the role of the courts in interpreting these statutes as well as the underlying scientific, economic, and policy rationales for environmental protection. Recurring themes will include the balance of federal and state authority, the influence of interest groups (both industry and environmental organizations) on environmental policy, and the disparate impact of pollution on vulnerable populations. The course will also cover recent developments in administrative and constitutional law that have significant implications for environmental regulation, such as the major questions and non-delegation doctrines. Please note that this course follows the Law School Academic Calendar which has a later grading deadline than the general UM calendar."
EAS 501.010,Environmental Law and Policy,Winter 2025,4,,"This course provides an introduction to the laws and regulations we use to address environmental harms. It focuses on the major pollution control statutes, particularly the Clean Air Act, Clean Water Act, Resource Conservation and Recovery Act, Comprehensive Environmental Response, Compensation and Recovery Act, and Toxic Substances Control Act. We will also examine the role of the courts in interpreting these statutes as well as the underlying scientific, economic, and policy rationales for environmental protection. Recurring themes will include the balance of federal and state authority, the influence of interest groups (both industry and environmental organizations) on environmental policy, and the disparate impact of pollution on vulnerable populations. The course will also cover recent developments in administrative and constitutional law that have significant implications for environmental regulation, such as the major questions and non-delegation doctrines."
EAS 501.011,Grad Experimental,Winter 2025,3,,
EAS 501.011,The International Development Career Landscape and How to Successfully Engage,Fall 2025,1.5,Allan Hruska,This course reviews the organizational and opportunity landscape for students interested in a career in international development and helps students review their skills and plans to begin engagement with the international development community. Students explore organizations and reflect on their interests and their potential professional growth. They will identify opportunities for further learning and engagement and develop a professional online profile (LinkedIn).
EAS 501.016,Applied Energy Justice,Winter 2026,3,Justin Schott,"Building on the foundations of Dr. Reames’ energy justice course (EAS 525), this lab-style course will engage teams of students in tackling some of the most urgent energy justice challenges in collaboration with leading non-profit and public sector institutions. Moving beyond theory and principles, the central focus of this course is advocating and advancing energy justice in the face of barriers and opposition. Students will learn to navigate political, financial, and regulatory constraints and consider tradeoffs between transformative approaches and incremental progress. Students are expected to have substantial knowledge of environmental justice and the U.S. energy system via coursework (i.e., EAS 525, 527, 574) and/or professional experience."
EAS 501.019,CAD,Winter 2026,1,Keenan Gibbons,"This course teaches basic digital design modeling + process. Design modeling fuses creativity with physical geometry, visualizations, and feasible implementation. It spans from the beginning of the undefined idea through every stage of deliverables in the life of a project. This course will define a real-world site through initial schematic/planning, design development, and preliminary implementation level documentation. The major deliverables equivalently occur at (3) intervals throughout the term, with smaller deadlines based on progress exercises therein. The course will move quickly with students given instruction to execute each task. Learning Objectives: Students will learn how to use AutoCAD Civil 3D as an integrated platform for contemporary multidisciplinary design. AutoCAD software is vast, but how we navigate it as landscape architects, planners, and urban design practitioners is distinct and hinges on the consistent and precise definition of modeling, scale, file management, and legibility, among other factors."
EAS 501.020,Energy Law,Fall 2025,3,,"This course is an introduction to U.S. energy law. The first portion of the course introduces the nation's sources of energy: coal, oil, biofuels, natural gas, hydropower, nuclear, wind, solar, geothermal energy, and energy efficiency. In doing so, it explores the physical, market, and legal structures within which these energy sources are extracted, transported, and converted into energy. The second portion of the course turns to the two major sectors of our energy economy -- electricity and transportation -- and the full range of federal and state regulation of each sector. The third portion of the course explores case studies of hot topics in energy law and policy that highlight the complex transitions taking place in the energy system. These topics may include electric grid modernization, electric vehicles, the role of energy innovation in addressing climate change, and the continued role of nuclear energy. In addition to traditional textbook reading and class discussion, the course may include industry, government, and nonprofit guest speaker presentations. Please note that this course follows the Law School Academic Calendar which has a later grading deadline than the general UM calendar."
EAS 501.020,Energy Law,Winter 2024,3,,"This course is an introduction to U.S. energy law. The first portion of the course introduces the nation's sources of energy: coal, oil, biofuels, natural gas, hydropower, nuclear, wind, solar, geothermal energy, and energy efficiency. In doing so, it explores the physical, market, and legal structures within which these energy sources are extracted, transported, and converted into energy. The second portion of the course turns to the two major sectors of our energy economy -- electricity and transportation -- and the full range of federal and state regulation of each sector. The third portion of the course explores case studies of hot topics in energy law and policy that highlight the complex transitions taking place in the energy system. These topics may include electric grid modernization, electric vehicles, the role of energy innovation in addressing climate change, and the continued role of nuclear energy. In addition to traditional textbook reading and class discussion, the course may include industry, government, and nonprofit guest speaker presentations. *Please note that this course follows the Law School Academic Calendar which has a later grading deadline than the general UM calendar."
EAS 501.023,Comp Modeling-Decarb Energy Systems,Fall 2024,3,Michael Craig,"Reliable, affordable, and clean energy systems underpin human and economy wellbeing in the United States and globally. As energy systems decarbonize, these three objectives – reliability, affordability, and cleanliness – could come increasingly into tension. This course will provide students an in-depth understanding of and hands-on experience with computational models that we use to operate and plan power systems. While the course will be grounded in the United States context, the model formulations and principles are applicable globally. Projects, problem sets, and readings will reflect diverse stakeholders’ viewpoints and introduce key skills and concepts."
EAS 501.023,Renewable Electricity and the Grid,Winter 2024,1.5,"Michael Craig Owusu-Obeng, Papa Yaw","Due to technological advancement and supportive policies, renewable energy technologies like wind and solar power are rapidly growing in the United States and globally. Integrating renewable energy technologies into power systems requires an understanding of generation technologies, the resources they depend on, power system planning and operations, and economics and policy. This course will introduce students to and give them experience working on each of these issues. Projects, problem sets, and readings will reflect various stakeholders’ viewpoints and introduce skills and concepts that renewable energy professionals employ. Lectures and coursework will draw on materials from around the world, but the majority of material will be from the United States."
